"name","country","description","tuitionUSD","websiteURL","rankQS_2026","rankQS_2025","rankQS_2024","rankQS_2023","rankQS_2022","rankTimes_2026","rankTimes_2025","rankTimes_2024","rankTimes_2023","rankTimes_2022","rankUSNews_2026","rankUSNews_2025","rankUSNews_2024","rankUSNews_2023","rankUSNews_2022","rankShanghai_2026","rankShanghai_2025","rankShanghai_2024","rankShanghai_2023","rankShanghai_2022"
"Hokkaido University","Japan","Japan's northern research university, a pioneer in agriculture, environmental science, and life sciences.","5400","https://www.hokudai.ac.jp","170","173","196","141","145","","","351","501","501","","","","","","","256","211","206","240"
"Kyushu University","Japan","A major Japanese national university in Fukuoka with strengths in engineering, medical sciences, and agriculture.","5400","https://www.kyushu-u.ac.jp","170","167","164","135","137","","","301","501","501","","","","","","","283","298","342","339"
"Waseda University","Japan","Japan's leading private comprehensive university in Tokyo, renowned for social sciences and engineering.","15000","https://www.waseda.jp","196","181","199","206","203","","","","","","","","","","","","","611","","679"
"Keio University","Japan","Japan's oldest private university, with top programs in medicine, economics, and law.","16000","https://www.keio.ac.jp","215","188","214","197","201","","","601","","601","","","","","","","293","321","325","307"
"Seoul National University","South Korea","South Korea's most prestigious national university, excelling in science, engineering, business, and medicine.","4500","https://www.snu.ac.kr","38","31","41","29","36","58","62","62","56","54","82","82","","82","82","","82","86","94","98"
"Yonsei University","South Korea","One of Korea's oldest and most prestigious private universities, known for medicine, law, and engineering.","10000","https://www.yonsei.ac.kr","50","56","76","73","79","86","102","76","78","151","","","","","","","176","205","205","210"
"Korea University","South Korea","Seoul's prestigious SKY university with strengths in law, business, medicine, and engineering.","9000","https://www.korea.ac.kr","61","67","79","74","74","156","189","201","201","201","","","","","","","217","235","215","222"
"KAIST","South Korea","Korea Advanced Institute of Science and Technology — Asia's MIT, world-class in engineering and CS.","4500","https://www.kaist.ac.kr","","53","56","42","41","70","82","83","91","99","116","116","","116","116","","269","246","246","265"
"POSTECH","South Korea","Pohang University of Science and Technology — a compact research university ranked among Asia's best in science.","5000","https://www.postech.ac.kr","102","98","100","71","81","141","151","149","163","185","","","","","","","343","374","392","374"
"Sungkyunkwan University","South Korea","Korea's oldest university (founded 1398), now a major research institution backed by Samsung.","9000","https://www.skku.edu","126","123","145","99","97","87","102","145","170","122","","","","","","","185","191","196","219"
"National Taiwan University","Taiwan","Taiwan's premier public research university, excelling in engineering, sciences, and management.","4500","https://www.ntu.edu.tw","63","68","69","77","68","140","172","152","187","113","118","118","","118","118","","253","220","222","205"
"University of Auckland","New Zealand","New Zealand's top-ranked university, with broad strengths in engineering, law, and health sciences.","32000","https://www.auckland.ac.nz","65","65","68","87","85","156","152","150","139","137","63","63","","63","63","","240","229","226","207"
"University of Otago","New Zealand","New Zealand's oldest university, renowned for health sciences, business, and humanities.","28000","https://www.otago.ac.nz","197","214","206","218","194","","","301","301","201","","","","","","","441","425","405","372"
"Hebrew University of Jerusalem","Israel","Israel's premier research university, founded in 1918, with remarkable strength in sciences and humanities.","11000","https://www.huji.ac.il","240","281","251","223","198","","","301","251","301","121","121","","121","121","","88","81","86","77"
"Tel Aviv University","Israel","Israel's largest university, internationally recognised for life sciences, engineering, and social sciences.","12000","https://www.tau.ac.il","223","209","215","261","255","201","201","201","201","201","","","","","","","202","213","208","167"
"Technion – Israel Institute of Technology","Israel","Israel's MIT, world-class in engineering, computer science, and applied sciences.","12000","https://www.technion.ac.il","350","416","392","409","330","","","351","501","401","","","","","","","97","85","79","84"
