"name","country","description","tuitionUSD","websiteURL","rankQS_2026","rankQS_2025","rankQS_2024","rankQS_2023","rankQS_2022","rankTimes_2026","rankTimes_2025","rankTimes_2024","rankTimes_2023","rankTimes_2022","rankUSNews_2026","rankUSNews_2025","rankUSNews_2024","rankUSNews_2023","rankUSNews_2022","rankShanghai_2026","rankShanghai_2025","rankShanghai_2024","rankShanghai_2023","rankShanghai_2022"
"Deakin University","Australia","Victoria's modern research university noted for nursing, education, and cybersecurity.","27000","https://www.deakin.edu.au","207","197","233","266","283","201","201","251","251","251","","","","","","","245","257","220","218"
"Queensland University of Technology","Australia","Brisbane's real-world university, strong in science, technology, and creative industries.","28000","https://www.qut.edu.au","226","213","189","222","213","201","201","199","201","193","","","","","","","316","284","316","300"
"University of Newcastle","Australia","Regional research university known for medicine, engineering, and environmental science.","26000","https://www.newcastle.edu.au","227","","","","","","","201","201","251","","","","","","","","","",""
"La Trobe University","Australia","Melbourne university with particular strengths in health sciences, law, and social science.","27000","https://www.latrobe.edu.au","233","217","242","316","362","","","251","251","201","","","","","","","388","370","304","298"
"National University of Singapore","Singapore","Asia's leading comprehensive research university, strong in engineering and medicine.","18500","https://www.nus.edu.sg","8","8","8","11","11","17","17","19","19","21","86","86","","86","86","","56","68","71","72"
"Nanyang Technological University","Singapore","Global STEM powerhouse known for innovation and industry partnerships.","16300","https://www.ntu.edu.sg","12","15","26","19","12","31","30","32","36","46","105","105","","105","105","","90","90","93","88"
"McGill University","Canada","Montreal's elite research university, world-class in medicine, law, and sciences.","28000","https://www.mcgill.ca","27","29","30","31","27","41","45","49","46","44","41","41","","41","41","","76","74","70","73"
"University of Toronto","Canada","Canada's largest and highest-ranked university, a global leader across all fields.","42000","https://www.utoronto.ca","29","25","21","35","26","21","21","21","18","18","16","16","","16","16","","25","26","24","22"
"University of British Columbia","Canada","Vancouver's leading research university, strong in forestry, medicine, and sustainability.","40000","https://www.ubc.ca","40","38","34","47","46","45","41","41","40","37","31","31","","31","31","","53","47","45","46"
"University of Alberta","Canada","Edmonton's major research university with world-class programs in engineering and health sciences.","30000","https://www.ualberta.ca","94","96","111","110","126","119","116","109","118","125","85","85","","85","85","","103","108","91","93"
"University of Waterloo","Canada","Canada's leading technology and engineering university, known for its co-op program and AI research.","38000","https://uwaterloo.ca","119","115","112","154","149","162","163","158","201","201","122","122","","122","122","","183","176","168","175"
"McMaster University","Canada","Hamilton-based research university, internationally renowned for health sciences and problem-based learning.","32000","https://www.mcmaster.ca","173","176","189","152","140","116","116","103","85","80","81","81","","81","81","","113","103","100","91"
"Western University","Canada","Ontario's comprehensive research university with strengths in business, law, and medical sciences.","38000","https://www.uwo.ca","151","120","114","173","170","201","201","201","201","201","","","","","","","314","290","314","265"
"Queen's University","Canada","Kingston's prestigious university with leading programs in commerce, law, and engineering.","38000","https://www.queensu.ca","191","","","","240","","","251","251","251","","","","","","","216","208","209","203"
"Peking University","China","China's top comprehensive university, excelling in humanities, science, and law.","8000","https://www.pku.edu.cn","14","14","17","12","18","13","13","14","17","16","32","32","","32","32","","23","24","29","34"
"Tsinghua University","China","China's premier technical and engineering university, a global research leader.","8000","https://www.tsinghua.edu.cn","17","20","25","14","17","12","12","12","16","16","35","35","","35","35","","18","22","22","26"
"Fudan University","China","Shanghai's elite comprehensive university with strength in medicine and social sciences.","7000","https://www.fudan.edu.cn","30","39","50","34","31","36","36","44","51","60","47","47","","47","47","","41","50","56","68"
"Zhejiang University","China","Top-tier research university known for agriculture, medicine, and engineering.","6000","https://www.zju.edu.cn","49","47","44","43","45","39","47","55","67","75","56","56","","56","56","","24","27","33","36"
"Shanghai Jiao Tong University","China","Elite engineering and science university in Shanghai, a C9 League member.","7000","https://www.sjtu.edu.cn","47","45","51","46","50","40","52","43","52","84","61","61","","61","61","","30","38","47","54"
"University of Science and Technology of China","China","Elite science-focused university in Hefei, ranked among Asia's best for research output.","5000","https://www.ustc.edu.cn","132","133","137","94","98","51","53","57","74","88","119","119","","119","119","","40","42","64","63"
"Nanjing University","China","Prestigious C9 university in Nanjing, renowned for physics, chemistry, and earth sciences.","6000","https://www.nju.edu.cn","103","145","141","133","131","62","65","73","95","105","79","79","","79","79","","75","84","96","126"
"Tongji University","China","Shanghai-based university with world-class programs in architecture, civil engineering, and environment.","5500","https://www.tongji.edu.cn","177","192","216","212","211","141","154","185","251","301","","","","","","","146","173","162","172"
"Wuhan University","China","Renowned comprehensive university in Wuhan, strong in information science, law, and remote sensing.","5500","https://www.whu.edu.cn","186","194","194","194","225","122","134","164","173","157","110","110","","110","110","","81","89","103","147"
"Beijing Normal University","China","China's leading education-focused university with strengths in social sciences and natural sciences.","5500","https://www.bnu.edu.cn","247","271","272","262","270","134","146","177","251","251","","","","","","","142","166","191","212"
"Harbin Institute of Technology","China","Elite engineering university in Harbin, globally renowned for aerospace and mechanical engineering.","5000","https://www.hit.edu.cn","256","252","256","217","236","131","152","168","351","501","","","","","","","106","106","110","157"
"Beijing Institute of Technology","China","Defence-oriented research university in Beijing with leading programs in engineering and IT.","5500","https://www.bit.edu.cn","259","302","340","355","373","201","201","251","501","601","","","","","","","102","123","129","175"
"Sun Yat-sen University","China","Guangzhou's leading comprehensive university, with strengths in medicine, law, and life sciences.","5500","https://www.sysu.edu.cn","276","331","323","269","260","201","201","201","251","251","","","","","","","65","73","74","80"
"Xi'an Jiaotong University","China","One of China's oldest national research universities, renowned for energy and engineering.","5500","https://www.xjtu.edu.cn","305","295","291","303","290","","","251","501","401","","","","","","","92","95","114","130"
"Huazhong University of Science and Technology","China","Wuhan-based powerhouse in engineering, medicine, and management.","5500","https://www.hust.edu.cn","319","300","275","307","334","176","166","158","176","181","","","","","","","73","79","92","97"
"Shandong University","China","Comprehensive research university with particular strengths in chemistry, materials, and medicine.","5000","https://www.sdu.edu.cn","339","316","360","397","403","","","","","","","","","","","","110","121","132","158"
"South China University of Technology","China","Guangzhou's leading technical university, known for engineering, architecture, and business.","5000","https://www.scut.edu.cn","377","385","392","407","407","","","251","401","401","","","","","","","129","146","148","187"
"Beihang University","China","Beijing-based aerospace engineering university, a national key university for aviation and astronautics.","5500","https://www.buaa.edu.cn","388","452","473","445","383","","","301","501","501","","","","","","","143","168","182","223"
"ETH Zurich","Switzerland","Switzerland's leading technical university, world-renowned for science, engineering, and mathematics.","1700","https://ethz.ch","7","7","7","9","8","11","11","11","11","15","23","23","","23","23","","22","21","20","20"
"EPFL","Switzerland","École Polytechnique Fédérale de Lausanne — a global leader in engineering, computer science, and life sciences.","1700","https://www.epfl.ch","22","26","36","16","14","35","32","33","41","40","","","","","","","44","57","54","110"
"University of Zurich","Switzerland","Switzerland's largest university, excelling in medicine, natural sciences, and law.","1700","https://www.uzh.ch","100","109","91","84","70","","","80","82","75","66","66","","66","66","","64","67","60","59"
"University of Geneva","Switzerland","Internationally oriented university in Geneva with leadership in international law, physics, and medicine.","1700","https://www.unige.ch","155","155","128","127","105","166","171","183","201","197","46","46","","46","46","","58","58","49","62"
"University of Basel","Switzerland","Switzerland's oldest university (founded 1460), known for natural sciences and medical research.","1700","https://www.unibas.ch","158","131","124","136","138","120","126","123","101","103","","","","","","","94","96","81","85"
"University of Bern","Switzerland","Federal capital university excelling in natural sciences, medicine, and social sciences.","1700","https://www.unibe.ch","184","161","126","120","119","108","104","116","94","101","","","","","","","156","138","143","139"
"Technical University of Munich","Germany","Germany's top technical university, with exceptional strength in engineering and life sciences.","680","https://www.tum.de","22","28","37","49","","27","26","30","30","38","94","94","","94","94","","45","49","62","56"
"LMU Munich","Germany","Ludwig Maximilian University, one of Europe's largest research universities across humanities and sciences.","750","https://www.lmu.de","58","59","54","59","","34","38","38","33","32","108","108","","108","108","","","","",""
"Heidelberg University","Germany","Germany's oldest university (founded 1386), renowned for life sciences and humanities research.","1500","https://www.uni-heidelberg.de","80","84","87","65","63","49","47","47","43","42","100","100","","100","100","","51","51","55","70"
"Free University of Berlin","Germany","Berlin's major comprehensive research university with leadership in social sciences and humanities.","750","https://www.fu-berlin.de","88","97","98","118","127","113","104","102","91","83","","","","","","","","","",""
"Karlsruhe Institute of Technology","Germany","Germany's leading engineering and natural sciences research institution.","750","https://www.kit.edu","98","102","119","142","136","166","166","140","189","180","","","","","","","320","287","337","276"
"RWTH Aachen University","Germany","Germany's premier technical university, a hub for industry partnerships and engineering innovation.","750","https://www.rwth-aachen.de","105","99","106","147","165","92","92","90","99","108","","","","","","","205","221","237","254"
"Humboldt University of Berlin","Germany","Historic Berlin university that pioneered the research university model, strong in humanities and sciences.","750","https://www.hu-berlin.de","130","126","120","131","128","89","84","87","86","74","","","","","","","","","",""
"University of Bonn","Germany","German Excellence Initiative university known for mathematics, life sciences, and philosophy.","750","https://www.uni-bonn.de","","","","","226","92","89","91","89","112","","","","","","","69","61","67","76"
"Technical University of Berlin","Germany","Berlin's technological university with global research in engineering, natural sciences, and economics.","750","https://www.tu.berlin","145","","","","159","160","140","136","156","139","","","","","","","277","265","293","309"
"University of Hamburg","Germany","Northern Germany's largest research university with strengths in natural sciences and humanities.","750","https://www.uni-hamburg.de","193","191","205","228","214","125","132","136","128","132","","","","","","","221","224","238","246"
"PSL University","France","Paris Sciences et Lettres — France's #1 research university, home to ENS, Dauphine, and Mines ParisTech.","4000","https://psl.eu","28","24","24","26","44","48","42","40","47","40","","","","","","","34","34","41","40"
"Université Paris-Saclay","France","Leading French research university known for physics, mathematics, and natural sciences.","4000","https://www.universite-paris-saclay.fr","70","73","71","69","86","68","64","58","93","117","","","","","","","13","12","15","16"
"Sorbonne University","France","Paris's flagship humanities and science university, successor to the medieval University of Paris.","4000","https://www.sorbonne-universite.fr","72","63","59","60","72","76","76","75","90","88","","","","","","","43","41","46","43"
"Institut Polytechnique de Paris","France","Alliance of France's most elite grandes écoles including École Polytechnique, a world leader in engineering and science.","15000","https://www.ip-paris.fr","41","46","38","48","49","68","71","71","95","91","","","","","","","223","323","303","361"
"Delft University of Technology","Netherlands","The Netherlands' largest technical university, world-class in aerospace, civil engineering, and architecture.","22000","https://www.tudelft.nl","47","49","47","61","57","57","56","48","70","75","","","","","","","191","182","161","161"
"University of Amsterdam","Netherlands","Comprehensive research university in Amsterdam, strong in social sciences, humanities, and medicine.","16000","https://www.uva.nl","53","55","53","58","55","62","58","61","60","65","45","45","","45","45","","132","128","120","117"
"Utrecht University","Netherlands","The Netherlands' highest-ranked comprehensive university, with excellence across disciplines.","17000","https://www.uu.nl","103","105","107","113","110","","","","66","69","52","52","","52","52","","57","55","53","54"
"Leiden University","Netherlands","The Netherlands' oldest university (founded 1575), renowned for law, humanities, and natural sciences.","17000","https://www.universiteitleiden.nl","119","141","126","132","","70","73","77","77","71","50","50","","50","50","","114","109","105","101"
"Wageningen University & Research","Netherlands","World's #1 agricultural and life sciences university, pioneering in food, environment, and sustainability.","17000","https://www.wur.nl","153","155","151","124","","66","67","64","59","53","49","49","","49","49","","163","184","178","156"
"Eindhoven University of Technology","Netherlands","High-tech engineering university in Eindhoven, closely partnered with ASML, Philips, and NXP.","17000","https://www.tue.nl","140","136","124","138","125","192","185","168","201","201","","","","","","","387","403","403","381"
"Erasmus University Rotterdam","Netherlands","Rotterdam-based university globally known for business, economics, and health sciences.","16000","https://www.eur.nl","140","158","176","208","179","107","107","99","80","72","65","65","","65","65","","101","101","89","87"
"University of Groningen","Netherlands","Historic Dutch university in Groningen, excelling in energy, life sciences, and economics.","16000","https://www.rug.nl","147","159","139","145","128","82","80","79","75","80","67","67","","67","67","","74","69","76","66"
"Karolinska Institute","Sweden","One of the world's leading medical universities, awarding the Nobel Prize in Physiology or Medicine.","16000","https://ki.se","","","","","","53","49","50","49","39","26","26","","26","26","","50","44","37","41"
"Lund University","Sweden","Scandinavia's largest university, strong in engineering, natural sciences, and medicine.","15000","https://www.lu.se","72","75","85","95","87","95","95","106","119","116","80","80","","80","80","","108","105","165","155"
"KTH Royal Institute of Technology","Sweden","Sweden's largest technical university, a leader in engineering, technology, and sustainable development.","15000","https://www.kth.se","78","74","73","89","89","98","95","97","155","201","","","","","","","234","240","250","238"
"Uppsala University","Sweden","Sweden's oldest university (founded 1477), internationally renowned for science, medicine, and humanities.","14000","https://www.uu.se","93","103","105","128","124","128","130","140","148","131","91","91","","91","91","","93","88","82","89"
"Stockholm University","Sweden","Stockholm's major comprehensive research university, with leadership in natural sciences and humanities.","14000","https://www.su.se","147","128","118","153","148","201","191","185","176","176","","","","","","","100","110","98","90"
"Chalmers University of Technology","Sweden","Göteborg's technical university, a European hub for sustainable energy, shipping, and automotive research.","14000","https://www.chalmers.se","165","139","129","125","121","201","201","189","251","251","","","","","","","398","419","422","443"
"University of Copenhagen","Denmark","Denmark's flagship research university, strong in medicine, natural sciences, and social sciences.","10500","https://www.ku.dk","101","100","107","82","79","90","97","103","114","96","25","25","","25","25","","35","32","32","39"
"Aarhus University","Denmark","Denmark's second-largest university, excelling in molecular biology, business, and social sciences.","11500","https://www.au.dk","131","144","143","161","155","101","110","109","117","104","87","87","","87","87","","85","80","78","69"
"Technical University of Denmark","Denmark","Denmark's leading engineering university, strong in sustainable energy, food science, and biotech.","11500","https://www.dtu.dk","107","109","121","104","99","121","124","126","166","185","","","","","","","170","155","159","181"
"KU Leuven","Belgium","Belgium's top research university, excelling in engineering, biomedical sciences, and law — founded in 1425.","10000","https://www.kuleuven.be","60","63","61","76","70","46","43","45","42","42","57","57","","57","57","","76","78","87","95"
"Ghent University","Belgium","Belgium's public research university, outstanding in biotechnology, veterinary medicine, and engineering.","8000","https://www.ugent.be","162","169","159","143","","115","112","115","107","96","77","77","","77","77","","91","90","84","74"
"University of Oslo","Norway","Norway's flagship research university, with strength in marine research, physics, and social sciences.","700","https://www.uio.no","119","119","117","101","102","113","116","127","126","119","","","","","","","84","72","73","67"
"Aalto University","Finland","Helsinki-area university formed by a merger of three top Finnish institutions, excelling in design, tech, and business.","16000","https://www.aalto.fi","114","113","109","116","112","195","196","201","201","201","","","","","","","436","473","387","388"
"University of Helsinki","Finland","Finland's oldest and largest university, a Nordic research leader in life sciences and social sciences.","15000","https://www.helsinki.fi","116","117","115","107","104","105","107","121","110","101","73","73","","73","73","","94","99","101","92"
"University of Vienna","Austria","Austria's largest and oldest university, internationally recognised in humanities, social sciences, and law.","1500","https://www.univie.ac.at","152","137","130","151","151","95","110","119","124","137","","","","","","","118","124","107","166"
"Trinity College Dublin","Ireland","Ireland's oldest and most prestigious university, founded in 1592, with excellence in arts, sciences, and engineering.","22000","https://www.tcd.ie","75","87","81","98","101","173","139","134","161","146","123","123","","123","123","","218","216","204","190"
"University College Dublin","Ireland","Ireland's largest research university, nationally and internationally respected for business, law, and sciences.","22000","https://www.ucd.ie","118","126","171","182","173","","","201","201","201","","","","","","","325","381","358","359"
"Politecnico di Milano","Italy","Italy's #1 technical university, world-renowned for design, architecture, and engineering.","4000","https://www.polimi.it","98","111","123","139","","","","201","301","351","","","","","","","","","",""
"Sapienza University of Rome","Italy","Europe's largest university by enrollment, with ancient roots and strong research in sciences and humanities.","2500","https://www.uniroma1.it","128","132","134","171","","170","185","181","201","197","","","","","","","144","131","131","112"
"University of Bologna","Italy","The world's oldest university (founded 1088), renowned for law, humanities, and life sciences.","3500","https://www.unibo.it","138","133","154","167","166","130","146","155","161","172","","","","","","","220","237","251","209"
"University of Padova","Italy","One of Europe's most ancient and prestigious universities, founded 1222, strong in science and medicine.","3000","https://www.unipd.it","233","","","","242","","","201","201","201","","","","","","","192","203","184","171"
"University of Barcelona","Spain","Spain's largest university, Catalonia's academic heart with strengths in chemistry, medicine, and social sciences.","3500","https://www.ub.edu","160","","","","168","","","152","182","193","","","","","","","195","196","200","185"
"Complutense University of Madrid","Spain","Spain's national university and one of Europe's oldest, with broad strengths across all disciplines.","3000","https://www.ucm.es","","164","171","226","223","","","501","401","501","","","","","","","317","335","339","255"
"Autonomous University of Madrid","Spain","Madrid's research-focused university, a leader in sciences, philosophy, and social sciences.","3000","https://www.uam.es","","","","","207","","","351","301","301","","","","","","","390","382","347","340"
"University of Hong Kong","Hong Kong","Hong Kong's flagship university, world-leading in law, business, medicine, and social sciences.","19000","https://www.hku.hk","11","17","26","21","22","33","35","35","31","30","","","","","","","67","70","88","96"
"Chinese University of Hong Kong","Hong Kong","A bilingual research university with strengths in business, medicine, and computer science.","17000","https://www.cuhk.edu.hk","32","36","47","38","39","41","44","53","45","49","","","","","","","468","142","142","136"
"HKUST","Hong Kong","Hong Kong University of Science and Technology — an elite research institution in science, engineering, and business.","18000","https://hkust.hk","44","47","60","40","34","58","66","64","58","66","","","","","","","235","293","336","322"
"Hong Kong Polytechnic University","Hong Kong","Hong Kong's applied science and technology university, with global leadership in engineering and design.","18000","https://www.polyu.edu.hk","54","57","65","66","66","80","84","87","79","91","","","","","","","152","170","190","197"
"City University of Hong Kong","Hong Kong","Dynamic research university renowned for business, law, science, and creative media.","17000","https://www.cityu.edu.hk","63","62","70","54","53","73","78","82","99","151","","","","","","","99","122","125","163"
"Hong Kong Baptist University","Hong Kong","Liberal arts-focused research university in Hong Kong with strengths in communication and pharmacy.","15000","https://www.hkbu.edu.hk","244","252","295","283","287","201","201","301","501","401","","","","","","","605","651","602","623"
"University of Tokyo","Japan","Japan's most prestigious university, a powerhouse in science, engineering, medicine, and humanities.","5400","https://www.u-tokyo.ac.jp","36","32","28","23","23","26","28","29","39","35","101","101","","101","101","","32","28","27","24"
"Kyoto University","Japan","Japan's second imperial university, known for independent thinking and strength in sciences and medicine.","5400","https://www.kyoto-u.ac.jp","57","50","46","36","33","61","55","55","68","61","83","83","","83","83","","47","46","39","42"
"Osaka University","Japan","One of Japan's leading national universities, with excellence in medicine, engineering, and science.","5400","https://www.osaka-u.ac.jp","91","86","80","68","75","151","162","175","251","301","99","99","","99","99","","222","219","192","193"
"Tokyo Institute of Technology","Japan","Japan's premier science and engineering university, merged into Institute of Science Tokyo in 2024.","5400","https://www.isct.ac.jp","85","84","91","55","56","166","195","191","301","301","","","","","","","139","179","187","169"
"Tohoku University","Japan","Japan's research powerhouse in Sendai, world-class in materials science, physics, and engineering.","5400","https://www.tohoku.ac.jp","109","107","113","79","82","103","120","130","201","201","114","114","","114","114","","226","215","202","187"
"Nagoya University","Japan","Central Japan's leading national university, with multiple Nobel laureates in chemistry and physics.","5400","https://www.nagoya-u.ac.jp","164","152","176","112","118","201","201","201","301","351","","","","","","","130","117","121","102"
